3,Support for request/reply,request/reply  http://www.mulesoft.org/documentation/display/current/Routing+Message+Processors#RoutingMessageProcessors-RequestReply  Mockups here: http://corp.wiki.mulesource.com/display/WP/Request-Reply#Request-Reply-Mockups 
2,"Input, process records and on-complete section should be vertically aligned","It would look a lot cleaner if the elements in the input, process records, and on-complete section were vertically aligned. See screenshot."
2,[Core Studio] Remove duplicate elements in core.xml,"There are many duplicate elements in core.xml    Duplicate entry detected! http://www.mulesoft.org/schema/mule/core/async - Please, remove it!  Duplicate entry detected! http://www.mulesoft.org/schema/mule/core/flow-ref - Please, remove it!  Duplicate ent"
1,Replace Batch icons with the final ones.,Replace Batch icons with the final ones provided by James Hall.
2,Server definitions don't accept two localIds for different versions,Right now each server loads all definitions and filters when an element is retrieved from the definition. When creating the server definition we need to only add the elements related to that particular server version.    This will allow to have two localI
2,Element: Multi transaction is not allowed to be child of element   VM,"Multi-transaction support for VM endpoints was added to Mule ESB in version 3.3.0    When nesting the ee:multi-transaction element inside a VM inbound or outbound endpoint, Studio marks that element as wrong, with the message:    *{color:red}Element: Mult"
1,DataMapper: Improve UI for user generated CSV window,Please see attached mockups.
2,Adjust field truncation and default rule expression checkboxes,"The checkboxes appear to be mutually exclusive, but don't act that way.    Please see attached mockup for guidance on implementation, and ping me with any questions you have."
2,Problem with Undo,"Steps to reproduce:  1.- Create a project with 2 flows  2.- Select the 2 flows  3.- Delete them   4.- CMD + Z     Issue: you get the followed exception     {code}   java.lang.IndexOutOfBoundsException: Index: 2, Size: 1    java.util.ArrayList.add(ArrayLis"
1,Typo: DataMapper error message,"Please fix the ""required"" typo in the datamapper error list window. See attached screenshot for location."
3,Cloud Connector: Deselect all default operations,"By default every cloud connector has an operation selected, which often presents errors to users before they configure the operation.  Users frequently get distracted by the errors and it causes friction.      Please set the default operation to a simple "
1,"DataMapper: Capitalize ""File (N)ame:""","Capitalize ""N"" in ""File name:"" in the first screen of DataMapper.    (See attached screenshot)"
2,Propagation rules for properties,"As a Studio user I want message properties, other than payload, to be propagated through the flow."
2,DataSense support for message properties,The DataSense Model should be extended to support metadata for message properties and variables (Today there is only support for payload)
2,DataSense support for enrichers,"As a Studio user I will like to have an enricher changing the datasense model.    We will need to define the rules for this, and what expressions at target level can be parsed to determine the destination of the metadata type."
2,onUnaccepted not available for idempotent-message-filter in studio,Support for onUnaccepted in idempotent-message-filter was added in #MULE-6556  However this attribute does not show up in the component properties when editing a idempotent-message-filter in the MuleStudio. Neither does it show in the auto completion.    
2,Define MVP for Mule Labs,Define MVP for Mule Labs
2,Design Web Services Consumer,This requires    # Defining Stories and Dependencies  # Close MVP  # Create Mockups
2,Create Web Services Consumer Editor (UI),"As a user I will like to configure Web Services Component through Studio UI.    * be able to discover a WSDL on my filesystem  * be able to type in a URL for a WSDL  * be able to choose the service, port, operation (based on WSDL) rather than type them in"
2,DataMapper: Deleting a filter in visual map leaves the folder collapsed,"There is an issue with Datamapper's filtering.      Steps to recreate:  1. Set up a DM mapping (doesn't matter what you're mapping)  2. Start typing a filter (either the input or output, doesn't matter), but ensure that your filter will have a result  3. "
1,"File Endpoint: Change the ""Output Pattern"" field title","A number of users have experienced friction understanding where to specify a file name in an outbound endpoint.  They don't understand that ""output pattern"" is a valid location to specify the name.      I propose we change the title to ""New File Name"" (**"
2,Support synchronous UntilSuccessful,"In Dolomite, the until-successful component was enhanced with a synchronous mode.    Enhance the componen so that:    * It has a synchronous attribute which defaults to false  * It has an optional threading-profile element"
3,Change operation in salesforce connector does not change correctly the parameter,"When using the SFDC connector and using the Query operation (which has Datasense) and choosing DataSense query language, everything works fine.    Now if I change the operation from Query to Query Single (having previously save the use of the operation Qu"
2,Anypoint Studio: Design new splash screen,"James will work with Chris Payne to get a new ""Anypoint Studio"" splash screen designed."
2,Support for new scatter-gather component,Add support for the scatter-gather component defined in MULE-7207    * Support all the child elements and attributes for scatter-gather  * Should work in debugger  * Metadata should propagate left to right through scatter-gather  * Metadata should be unkn
2,[DM] Support root abstract types ,When Root Type is an abstract type user should input what implementation Type want to use.
2,[DM] Support Abstract types Dynamically,If there is an Abstract Types user may want to create different implementation based on the input type. The implementation will be picked at runtime. Implementation should support both xsi:type overriding and substitution groups.  E.g.  User will be able 
2,Add missing attributes socketMaxWait and connectionTimeout to TCP Connector,"In TCP Connector Add attributes *socketMaxWait* since *3.3.0*:    {code}                  <xsd:attribute name=""socketMaxWait"" type=""mule:substitutableInt"">                      <xsd:annotation>                          <xsd:documentation>                 "
2,Rename Mule Studio to Anypoint Studio,"Rename Mule Studio to Anypoint Studio.  * About Screen * Artifact names * Default installation location * Application name in Mac menu bar * Splash screen  Also, find and replace all other text occurrences of ""Mule Studio""  "
2,Use dot notation for all properties in MEL auto-complete,"With the upcoming changes in MEL, we can use dot notation everywhere. "
2,Adding autocompletion support for properties propagation,"Add autocompletion support to flowVars, sessionVars, inbound and outbound properties. Supporting the propagation changes. "
1,Repackage new MVEL libraries,Update our MVEL branch with latest MVEL changes.
2,Web Services: Create new icon,Design a Web Services Icon for the Palette and Canvas.
1,DB: Create Update Editor,Create Update Editor
1,DB: Create Delete Editor,Create Delete Editor
2,"Must	 be able to discover a WSDL on my filesystem",Must be able to discover a WSDL on my filesystem so that the consumer can find my service metadata.
2,Must be able to type in a URL for a WSDL,Must be able to type in a URL for a WSDL so that the consumer can find my service metadata
1,DB: Add Metadata support for Insert,Add Metadata support for Insert
1,DB: Add Metadata support for Update,Add Metadata support for Update
1,DB: Add Metadata support for Delete,Add Metadata support for Delete
2,DB: Enable DataSense Normal Datasense propagation ,Enable DataSense Normal Datasense propagation 
2,DB: Deprecate old Database/JDBC Element,"Old Database should be renamed to ""JDBC (deprecated)"". "
1,DB: Add support for transactions,Add support for transactions
1,DB: Create palette and canvas icons for new database elements,Create palette and canvas icons for new database elements
1,DB: Define palette location for new database elements,Define palette location for new database elements
2,Framework: Implement a type/category filter language for describing which elements can exist inside a container,"We need to iterate over the existing category/types filtering capabilities that were implemented in the framework for batch (containers).   Currently containers can declare which category/types they accept or are accepted in, but only supporting one logic"
2,"DataMapper: ""Generate Default"" should provide feedback when successful ","When a user chooses to ""Generate Default"" in Datamapper, feedback should be provided when default generation has completed.      See mockups for guidance (notice that the mockups represent a few phases of improvement):  http://corp.wiki.mulesource.com/dis"
4,"Enable collapsable elements when appropriate (i.e. All, Choice, Scopes)","When having complex flows, MP's like All, Choice and Scopes, clutter the interface too much. Studio should give the option to collapse such items for readability."
3,Studio debugger should generate MEL query when click on element,"Studio debugger should auto-generate the MEL Query for the selected element in the ""Debugger View""."
3,Show Choice branch expression on-hover and allow in-line editing,"When working with choice routers, currently its very cumbersome to really know which branch condition does what and we end up going to the XML view every time. It would be nice if we could just hover on top of the branch and studio would show the conditio"
4,Show preview of referenced flow when hover on flow-ref,"Sometimes (especially when maintaining an application) we need to track what is the application logic. However, when doing flow-refs it can be hard to track where is the referenced flow and then come back again to the calling flow. Thus, it would be nice "
4,Switching from Message Flow view TO Configuration XML view should focus on the corresponding XML element,"When working with complex configuration files, we usually need to go back and forth between the graphical and xml view. It would be much more efficient if when switching to the XML view, Studio would automatically focus the XML section related to the grap"
1,Web Service Consumer is not generating right metadata,The metadata that the web service consumer is generating does not represent the entire message of the operation. It Just propagate the first part of the message. 
2,Web Services consumer :: In some cases the connection to the WSDL takes too long and there isn't a Cancel option,"When attempting to connect to a WSDL and the connection takes too long, there is no way to cancel the operation and Studio does not respond.    steps:   Add a Web service consumer to the canvas and enter the following url in the WSDL field, or any url for"
2,Studio support for OAuth 2.0 Module inclusion in Mule,"The OAuth 2.0 module will be merged with Mule EE starting with the Dolomite version (3.5.0-M4).     As a user, I want Studio to support this configuration. OAuth 2.0 should appear as an option in the palette OOTB with 3.5.0-M4 and up, and if the user upda"
2,Shortcut to switch between 'Message Flow' and 'Configuration XML' views,Switching between both views is very common and a shortcut would really improve that experience.
2,Unify connectors and endpoints across Studio (phase one),Details here: https://docs.google.com/a/mulesoft.com/spreadsheet/ccc?key=0Ag_HMY-0TfqodGoxWHBfVFNkZ3kxS0FBSEtUQWswMkE&usp=drive_web    
1,Rename SOAP to CXF in palette,Rename SOAP to CXF in palette
2,Support DataMapping with no/null payload,"As a user, I want to be able to do DataMapping, even if I have a null payload so that I can map my input arguments to my output for creating web service queries.    e.g. someone is polling a web service and using the watermark to create the query."
3,WebServices: apply XML changes to our current web service consumer ,We need to apply the ESB XML changes to our current editor.     Pending: add spec. 
2,DB: Polish database editors,Add support for syntax highlight. Make the editor look similar to the one in SFDC Query. Add autocompletion for MEL expressions. Make it look better in general.
2,DB: Add support for connection pooling elements,Add support for connection pooling
2,Metadata Outline Should Support Describe XML Model,In order to make XMLMetaDataModel being display in the Metadata Outline. The object in commons needs to be self descriptive. In order to do this the logic around schema introspection needs to be implemented. 
2,Support type grouping for Connectors with DataSense,Support Type grouping for Connectors and DataSense. Integrate with Dev-kit.
1,DB: Add palette search keywords to New Database connector,"Add palette search keywords to New Database connector. Make it appear under suggestions when searching for sql, database, mysql, select, insert, etc."
2,DataMapper  cannot process large XSD files,When using the XSD file attached in this issue and selecting *Root Element*: TXLife:  * Creating the mapping takes very long * Studio runs out of memory  {code} java.lang.OutOfMemoryError: Java heap space   sun.text.UCompactIntArray.initPlane(UCompactIntA
2,Studio should have smarter validation for property-placeholders,"In spring to allow multiple property placeholders, you need to use the attribute *ignore-unresolvable*.    If not you get an error that the placeholder variables cannot be found:    {code}  Test connection failed: Invalid bean definition with name 'MySQL_"
2,Support MEL auto-complete in choice,Choice should support autocompletion of expressions.
2,Support MEL auto-completion with DataSense query editor,"When building conditions for a DataSense query, we should support auto-completion.   * Filter values * DSQL/native query language text box  "
3,Classloader leaks prevention in DataSense,"When using DataSense, leak prevention needs to happen around JDBC, Threads, Timers, MBeans, etc. to ensure that the DataSense classloader is garbage collected."
4,Add friendly name and description to DataMapper,A friendly name and a long description are getting added into the metadata model for fields. DataMapper and the payload explorer should use these to represent the payload.    Needs mockup.
1,Move New DB connector back to CE Studio,Move New DB connector back to CE Studio
4,Changes in Mule Properties View can't be saved until the view loses focus,"When editing fields in the Mule Properties View,  in order to save the changes I've made,  I need to focus other view for Studio to allow me to save the file.    The ideal behaviour would be that it allowed me to save changes immediately after I change a "
1,New Database: Move inner db operation child elements from xxx-sql to xxx-query and template-sql to template-query-ref,Change inner db operation child elements from xxx-sql to xxx-query and template-sql to template-query-ref in accordance with the new xsd changes.
2, Flow Ref: Display name should display name of referenced flow.,"When a user selects a flow to reference in a flow ref, the display name should automatically update with the name of the selected flow.    "
2,Connection explorer: removing a configuration does not update the config reference drop down,"When removing a configuration from the Connection explorer, the ""config reference"" drop down is not updated"
4,SubstituableNames on the ESB schema allow property-placeholders but not expressions,"Need to review all attributes in Mule XSD files that are defined as *type=""substitutableName""* and mark them in Studio as fields that accept:    * String literal value  * Property Place-holder: ${prop.name}  * *DO NOT* accept expressions: #[expr]"
3,Connectors: Improve connector version selection,"Users often mention that they get annoyed by the ""Use newest version of connector?"" popup (although they never click the ""remember my selection"" box)"".    Please see mockup for details of the improvement: http://corp.wiki.mulesource.com/display/WP/Connect"
1,"Rename ""Documentation"" Tab to ""Notes""","Please change the name of the ""Documentation"" tab name to ""Notes"".   This change should be coupled with the connector simplification to minimize the need for new screenshots in Documentation.   See attached screenshot for location clarification.  * Change"
2,New Database: Problem in the xml merge when changing the operation in the editor,"When using the new db connector if you have a configured MP, change the operation in the operator and go to the xml, the xml is not well-formed, resulting in things like:     <db:select>                 <- The new operation in the editor  ...  </db:stored"
2,Don't retrieve metadata if connector isn't configured,We should not try to retrieve the metadata if the required fields on the connector are not filled out.
4,editor view should automatically gain focus when MP is selected,"When I select a message processor in the canvas, the editor is opened in the views panel but it doesn't get focus automatically. That means that it takes me two clicks to see the config of any processor which is not a good experience when developing, and "
2,Properties/variables don't stay expanded when navigating between message processors,"As a user, I want my properties and flow variables to stay expanded or collapsed when moving from block to block in Studio."
2,Preference pane cleanup,"* Move web service cache settings to DataSense preferences. Should be under the heading ""Web Service Consumer""  * Authentication tab goes away, see STUDIO-7199 * Remove the API Manager 1.0 tab  * Cloud Connectors should be called Connectors (including the"
2,DataSense not available in watermark,"See attached screenshot. I have a poll element with a cloud connector that returns a pojo. When I'm writing the watermark expression, DataSesnse should be able to know exactly what the payload is and offer me auto completion capabilities.  However, it doe"
1,Move add message property to top of properties,"The ordering in the message properties transformer isn't according to the most used operations.     It should be add first, then delete.    This is a usability issue in the pre-sales workshop."
2,Prototype new DataSense experience,Acceptance criteria:  * DataMapper retrieval should not block the user (background retrieval)  * Refresh button which refreshes object list  * Refresh button which refreshes message processor metadata  * Optional share metadata between processors  * Shoul
2,Unify connectors and endpoints part 2,Need to finish implementation of https://docs.google.com/a/mulesoft.com/spreadsheet/ccc?key=0Ag_HMY-0TfqodGoxWHBfVFNkZ3kxS0FBSEtUQWswMkE&usp=drive_web
2,Propagate metadata for record vars,Need to propogate record variable information across batch steps.    
2,Add aggregation strategies to global elements,Support creating an aggregation strategy for the global elements.  http://corp.wiki.mulesource.com/display/WP/Miscellaneous#Miscellaneous-ScatterGather  * Be available in the global elements create tab * Aggregation strategies are show in list/chooser in 
2,Debugger support for record variables,Need to support record variables inside the debugger.
3,Watermark should set flow's processing strategy,"Watermark functionality requires the owning flow to have a synchronous processing strategy, which is fine.    However, synchronous is not (and should not be) the flow's default. That means that when I put a watermark in a flow and I start the application,"
1,Improve Studio Analytics (KissMetrics) reports to include Studio version and OS,"Improve Studio Analytics (KissMetrics) reports to include Studio version and OS.    Report url should include: ""?version="" + studioversion + ""&fullVersion="" +  fullStudioVersion +""&os="" + runningOS + ""&javaVersion="" + javaVersion"
2,Make DataSense combo-boxes searchable,"When I'm looking to find an object in Salesforce, I expect that the combo box should be searchable when I start typing so I can quickly find what I'm looking for."
2,There is no general tab to clear application data when running junits,"There is no general tab to clear application data when running junits.    This complicates the run of, any kind of tests in particular any functional test case that runs an application that relies on OS.    Please check attached documents"
4,Improve UX of payload/variable/property selection in data mapper,We need to improve the UX as we all agree it's fairly confusing. TBD how exactly to do this.
2,Drag item from metadat explorer and create expression,"As a user, I want to be able to drag an item from the DataSense explorer into a text box and have an expression generated for me.  Acceptance criteria: * Must work with payload, variables, and properties * Must use ""."" syntax  * Must properly escape prope"
2,Add preference for deprecated message processors,"Users should be able to configure whether or not they want to show deprecated message processors.    Acceptance Criteria:  * If a message processor was deprecated in 3.5, it must be hidden/shown according to the preference in projects 3.5 and above  * If "
2,Push Cascade fixes to update site,* need to document changes and add them to release notes 
2,Move endpoint to front of flow,"Users have attempted to drag an endpoint from the end to the start of a flow.  Studio should allow this action, and throw a warning if settings will be overwritten.    Mockups here: http://corp.wiki.mulesource.com/display/WP/General+Improvements#GeneralIm"
3,Navigation: Focus should jump to newly added message processors,"When a user adds a new message processor to the flow, the focus should jump to the new MP and information should appear in the Mule Properties View."
4,Allow users to highlight and copy disabled text,"Users have attempted to highlight and copy text in disabled fields, which is currently impossible.    A recent example is the MySQL Database Config ref."
2,Datasense deadlok when configuring global element first,"The problem is that the whole DataSense story is though for users that start adding an endpoint or operation to the canvas and then configuring the global config element. When creating the connector configuration first, users will end up in a deadlock.   "
2,WSC :: Real world web services and schemas :: Testing,Studio QA - we have some great real world web services and schemas here. Can we get these into the QA plan and test them? Keep in mind that they're confidential.     DanD.
2,Testing :: FHIR schemas brought into our QA,FHIR schemas brought into our QA: http://www.hl7.org/implement/standards/fhir/downloads.html
2,Update DM MEL functions to be null safe,"Need to update the DM MEL functions so that if the receive null, they also return null."
2,"On metadata retrieval failure, give users options",Options should be:    1) Don't retrieve metadata & disable  2) Edit connector configuration  3) Retry   
2,Share metadata types across message processors,We should store metadata so we can reuse it across message processors whenever possible so the user doesn't constantly get bombarded with popups.
2,DataSense explorer should support record variables,Need to add support for showing record vars in the explorer. Record vars should be shown all the time.
1,Implement HA flag for performant vs reliable mode,Implement Studio work for EE-3877.  See spec in http://corp.wiki.mulesource.com/display/WP/Mule+Cluster+Performance+Profile
1,Upgrade SAP Connector for Mule 3.4.x and 3.3.x to version 2.1.2,Upgrade SAP connector for Mule 3.3 and 3.4 to be the latest released one.
2,[Usability] [DataSense] Cancelling a Retrive DataSense types operation triggers new retrievals,Cancelling a Retrive DataSense types operation pressing cancel on the dialog triggers new retrievals most of the time.
2,[Palette] Palette's toolbar filter erases the text when hitting enter,"When filtering the elements in the palette by adding a filter (lets say ""salesf"") the components are filtered properly.  But if the enter keyword is hit, the complete text disappears, erasing the complete filter.    As hitting enter doesn't do anything (a"
2,"If user searches for All in palette, suggest Scatter-Gather","With the deprecation/disappearance of the All component, we should suggest Scatter Gather in the palette when a user searches for All."
4,Mel autocompletion should avoid adding quotes when identifiers have valid characters ,"add variables with names:  ""foo"", ""foo1"",""foo 1"" and ""foo+a""    when autocompletion from ""flowVars.""    should autocomplete:    flowVars.foo  flowVars.foo1  flowVars.'foo 1'  flowVars.'foo+a'"
2,"Radio Booleans: when changing the radio button, the one previously selected should be disabled and greyed ","Check attached screenshot.     The component and text under the Update Expression, should be greyed.       "
2,Generating mappings without isnull for 3.5 and above,"Now that DM functions are null safe, we should generate mappings without isnull since it is much more performant. Previous runtimes should still behave the same way as before."
3,Spike: Retrieve DataSense as a background process,"Per original mockups, we should update the UI asynchronously as we load metadata in the background.    The plan is to divide it into two phases: Retrieve types in the background, then retrieve metadata structures in the background."
