3,Support for request/reply,request/reply  http://www.mulesoft.org/documentation/display/current/Routing+Message+Processors#RoutingMessageProcessors-RequestReply  Mockups here: http://corp.wiki.mulesource.com/display/WP/Request-Reply#Request-Reply-Mockups 
2,Cannot import a Studio project from Git without errors,"Steps to reproduce:    1. Create a simple Mule Studio project (for instance: the Echo example)  2. Push it into GitHub, pull/clone the repository into your local instance  3. Open up a brand new workspace  4. Goto Import/Git/Projects from Git  5. Select t"
2,Changes to Java code do not get hot deployed,"Java source changes don't get picked up right now automatically (see STUDIO-381) however, even if a redeploy is triggered the latest java changes are not deployed"
2,Unable to add a response when creating a second flow in the same mflow,"Unable to add a response when creating a second flow.    Steps to reproduce:    1) Open Studio and create a project from an existing template: Order Discounter.  2) In that same mflow file create another flow. Drag and drop HTTP RQ-RS, echo, flow referenc"
2, Namespaces in the XML view are not being removed when you remove all the elements of a kind,"When you add an element and then you remove it, the reference to the schema file is not being removed from the XML namespaces.      Steps to reproduce:   1.- Create a project in Studio with a flow in it and go to the Global Elements tab.   2.- Add for exa"
2,"Would save time to be given the option to create a class in addition to selecting an existing class inside a widget dialog box (e.g., Component)",Add a button in the ClassFieldEditor to create the class inline. 
2,View the class code just by clicking on the class name displayed in the widget dialog box,"Currently, to view the class code (e.g., component) specified in the widget configuration, I have to leave the dialog box to find it. A very desirable feature would be to view the class code (as a separate tab in the editor ) just by clicking on the class"
2,Reference to the subflow get lost when changing the subflow name (Exception Strategy),Steps to reproduce:   1.- Create a project in STUDIO with a flow and a sub-flow  2.- Go to the Flow properties window and set the Exception Subflow ref combo to the subflow that you have. Clic OK.   3.- Change the name of the subflow.  4.- Open the flow p
4,"Studio can be a lot smarter when handling logic expressions. I'd rather not see AND, OR, NOT filters in the palette","it seems we could have a single filter element in the flow control section that has one dialog that allows people to select an expression (this works for wildcard and regex) and have a section below to allow the user to add new filters with AND, OR or NOT"
2,Response section is not displayed,"My config is as follows:  <flow name=""TicketFlowFlow1"" doc:name=""TicketFlowFlow1"">          <composite-source>              <http:inbound-endpoint exchange-pattern=""request-response"" host=""localhost"" port=""8081"" doc:name=""HTTP""/>              <vm:inbound-"
2,Able to drag and drop composite source and poll as response elements,I am able to drag and drop composite source and poll as response elements of a flow. This is not correct: we should not let the user be able to drop composite source and poll there.     When dropping them as response elements an empty response box is crea
3,"There is no specification when there is a global endpoint or a connector created in the global elements table, they are just called the same and it is confusing","This is a usability issue: There is no specification when there is a global endpoint or a connector created in the global elements table, they are just called the same and it is confusing.    Steps to reproduce:  1. Create an FTP global endpoint.  2. Crea"
2,Executing simple lookup table configuration is showing error message,"Created a Java to XML mapping and configured a lookup table with 2 fields: subject(Key) and email.  Executed the Preview an error message was displayed: ""Message:Transform Failed!"" (see attached screenshot)    "
2,Unable to create new mappings using new excel format xlsx,Unable to create a new mapping using an excel spreadsheet with the new format .xlsx    To reproduce:  - Create new mapping  - Input: Select MS Excel  - Add the .xlsx spreadsheet attached to this issue  - Output: Select anything  - Click Finish button (err
2,Multiple xml validation errors in Studio editor,"1. Element JAX-WS Service is not allowed to be child element of HTTP.    Oh, it is allowed, and often times it makes perfect sense to have it as a child element rather than subsequent one. False alarm.    2. Flow should start with inbound endpoint    No, "
2,Undo option (command + z / Ctrl + z ) does not work if you remove a global element,Steps to reproduce:   1.- Go to the global elements tab and create any element.   2.- Remove it.   3.- Press Ctrl + z or Command + z     Issue: the element does not appears again  
2,Suggest to stop the corresponding running mule instance when deleting a project,"Steps to reproduce:  1 - Create a project  2 - Run it as a mule application  3 - Try to delete the project, including files.    An error dialog will pop up, related to mule still using the files and directories that are being deleted. To complete his desi"
2,"Default of ""Auto delete"" in the File endpoint is hidden in a non-usable way","To see or edit the ""Auto delete"" option of the File connector you have to:  - Go to the end point properties  - The choose ""Reference""  - Add a reference in Global References->Connector Reference  - The autodelete option is there (see the attached screens"
1,Add JAXB support,It would be nice if you could support jaxb operations from GUI such as jaxb-xml-to-object-transformer jaxb-context etc.
3,More easily navigate between XML and GUI,"It should be much easier to navigate from the GUI to the appropriate XML element or flow block within the XML. Furthermore, it would be great to go the other way as well, to click on an XML element and bring the user directly to a highlighted flow element"
2,Studio is not validating that certain scopes should start only with inbound or outbound endpoints,"(edit) This bug was first discovered for exception strategies. This is the description for that case:    When using the Message Flow tab, you can't drop inbound-only-endpoints into exception strategies (the UI forbids it). But you are able to do so throug"
4,Error unzipping MuleStudio in Windows in a long path,When unzipping MuleStudio in a long path (For example under Desktop or Document and Settings)  the errors shown in the attached screenshots may be shown.    The password protected error seems to be a Windows bug as explained in http://blogs.msdn.com/b/rob
1,Unable to drag a Twitter neither a Salesforce Streaming from the palette into the composite source,"Unable to drag a Twitter neither a Salesforce Streaming from the palette into the composite source.    Composite source can contain only message sources, therefore we should be able to drag and drop Salesforce and Twitter streaming into the composite sour"
2,Studio cannot be pinned to the taskbar,"Unlike other windows programs, Studio cannot be pinned to the taskbar for quick access. I am aware that this is a problem with Eclipse in general, but I wanted to make it clear it is an usability issue for our users.  When I right-click on the taskbar ico"
2,Studio Online Help Enhancements,1) Adding new content created by Antonio/Doc-team for dynamic help.  2) Adjusting widget IDs to make sure that they are associated with dynamic help content.  3) Displaying the dynamic help tab by default in Studio upon first start.    
2,Fixing MES Studio behavior for fields that use Collections,http://www.mulesoft.org/jira/browse/DEVKIT-240
2,Studio Support for WebSockets,As defined by the specification.
2,Adding Reference to CH Analytic end-point on Studio Start,"Whenever Studio starts, we should send a GET request to the following URL:  http://<ch-app-hrl>/e?&_p=<studio-id>&_n=<example-name>  Where <studio-id> is a unique ID associated with the downloaded Studio instance, and <example-name> is the name of the exa"
2,Addition of DB2 and MS SQL Server to the list of databases on Studio JDBC connector configuration window - Studio Work,"Today we show MySQL, Derby, and Oracle. However, MS SQL and DB2 are RDBMS's with very large footprints. As such, we should add these two databases to the set that shows up on the JDBC connector's configuration screen. "
1,Only queryKey is marked as mandatory for JDBC endpoint while Address is a valid attribute if queryKey is not specified,Only queryKey is marked as mandatory for JDBC endpoint while Address is a valid attribute if queryKey is not specified.    A query should be referenced from the JDBC endpoint by queryKey or Address.    Nowadays when you have specified the Address attribut
2,error adding context:property-place-holder,"Since it's not possible to add a context:property-place-holder tag from the pallete, I switched to the editor view and used auto competion to generate this declaration:    <context:property-placeholder location=""mule.properties"" />    Studio added the xml"
1,"cloudhub integration needs progress bar, cancel button and run in backgroun","when deploying an app in cloudhub, the actual file upload can take a while depending on the connection and the app size. During that time, there's no way of knowing if the app is still responsive and you can't do anything else.    Also, if after pushing t"
4,Components and flow arrow inside response block should be displayed in the reverse order,"A flow shows the request and response message flow inside a flow using arrows with different direction: request goes from left to right, response foes from right to left.  That is not the case when there is a ""response"" component which is part of the resp"
2,Direct-edit display name has a strange behavior under Windows,"In Windows, when direct-editing the display name of an element in the canvas, the ""editing box"" has a couple of strange behaviors:    * When writing the name from scratch (erase everything and start writing), the FIRST character shows, but upon typing the"
1,DM field editor navigation,"It should be really cool that when on the field editor or the data source editor when you hit the tab key you get to the other column or at lease the other row.    Now a days  it just focus on the OK button, so you have to move with the mouse to navigate "
2,Exception Strategy inside choice making trouble,"When you try to insert a reference exception strategy inside a choice, nothing happens in the message flow view, but, on the backend, in the xml view, the exception strategy is being added.    See both screenshots"
2,"When deleting a field, everything seem to be deleted due to collapse","When you are mapping fields, and realized that you have added one field that is not going to be used and delete it, all the map is automatically collapsed, giving the idea that everything was deleted.     End user may not realized that it's just a collaps"
2,"When looking for JDBC in the Global Elements filter, nothing is shown","Go to the Global elements tab, clic on create and write JDBC in the filter."
2,Entity IDs are not being generated correctly,"(Setting XMLGeneration as Component, but this does not really relate to the application XML generation -mule config- )    Entity IDs in the .mflow are being (again) generated as long random strings.    Steps to reproduce:  # Create a project/flow.  # Drop"
2,Warning icon shown in GUI but not in XML,"The UI shows that the SAP Transformer has a warning, but nothing is displayed in the error log or the XML view.    See attached screenshot.    Is the problem related to the SAP editor XML definition?"
2,Bad maven project import in studio using studio:studio,I tried to import a project using studio:studio and I had a couple of issues when trying to generate and deployable archetype using export:  1 - Project does not included maven dependencies in lib folder  2 - Export complains if folders src/main/resources
2,"Data Mapper DB Lookup Table, java.sql.SQLException: Streaming result set com.mysql.jdbc.RowDataDynamic is still active",Using the same Lookup Table multiple times in one mapping transformer led to exception during runtime.
2,Studio randomly crashes when multiple flows are re ordered and referencing one another.,Hi     Our user is still seeing these crashing issues with Studio even after applying all of the updates.     Here is what they've told me.     They have a project with a main flow and multiple sub flows. They think part of the issue may be how Mule is up
2,There are problems when you zoom out in a flow,"Steps to reproduce:   1.- Create a project with a config file and several flows in it.   2.- Add some exception strategies also   3.- Zoom out by pressing Ctrl - or Command -      Issue: you can see some elements drawn in the right side, check screenshot "
2,When doing drag and drop you are not able to scroll across the long canvas,"Steps to reproduce:     1.- Create a config file with many flows in it.   2.- Try to scroll down when doing drag and drop    Issue: you are stock and not able to scroll, take into account the use case when you zoom in and out."
2,Static Component in a poll is removed when generic endpoint connector is changed or removed in Message Flow ,"I tested it in the following way:    1. Created two global endpoints  a. name = “GE1”, address = “stdio://out”  b. name = “GE2”, address = “file:///tmp/test”  2. Created a new flow.  3. Added a polling component with a frequency of 10 seco"
1,JDBC EE namespace appended to almost everything,"The JDBC EE namespace is being automatically appended to everything in my config file. Even if I delete those chunks of code, they will reappear.  E.g.:    {code}  ...  <jdbc-ee:connector name=""SecureDB"" dataSource-ref=""secureJDBCDataSource"" validateConne"
4, Losing the Undo option when moving from flow to the xml view and back to the xml view,"When modifying something in the Flow view and moving to the XML view and then back to the Flow view, the Undo option is no longer available. This is an usability issue.    "
1,Mule config file from src/test/resources get copied in src/main/app,"If you create a functional test case that uses an xml config contained in the folder src/test/resources, as soon as you open it, an mflow will be generated, the correspondent config xml will be added to the src/main/app and it will be added to the mule-de"
2,XSDs with namespaces and XML without namespaces issue,"When the XSD has namespaces and the received XML doesn't, DataMapper doesn't do the mappings correctly."
2,DB lookup fields displayed in the Mappings view does not have the correct field names,"When creating a DB lookup table in data mapper and entering the fields we want to extract from the database (name, surname, etc) when going back to the Mapping View, the field are displayed with default names like field1, field2, field2, etc.    See attac"
2,DataMapper Encrypting database lookup password over and over again,"When configuring a database lookup in a datamapper component and encrypting the password, each time the user clicks the Finish button from the configuration, the user is requested for the encryption password and the password is re-encrypted over and over "
2,properties-ref in context:property-placeholder is not allowed and silently removed,"properties-ref attribute in context:property-placeholder is not allowed and Mule Studio silently removes it when saving in graphical view, replacing it with an empty location attribute."
2,"In the SOAP dialog box, when operation is set to JAX-WS client, no browse button exists for setting the client class","In the SOAP dialog box, when operation is set to JAX-WS client, no browse button exists for setting the client class."
1,Salesforce connector losing Global Element Properties information,The Salesforce connector y losing information from its global element properties (URL and proxy port) when going back from the XML view to the message flow.    To reproduce:    - Create new project  - Add the salesforce connector to the project  - Double 
1,Choice Router cannot edit routes in Win32XP,"The Choice router has un-editable fields for the expressions.    Can workaround by going to XML, but we still need to support this browser.  A lot of big companies are scared of new technology."
2,DataMapper: Exception raised when trying to map the MuleMessage Interface,Steps to reproduce:   1.- Create a flow with a DataMapper and open the wizard.   2.- When configuring the wizards select to map a Pojo   3.- Select Java Object and search for the class MuleMessage Interface   4.- Clic OK     Issue: the followed exception 
1,Studio doesn't support complex type nor lists,"These are actually 5 bugs in one, so brace yourself... errors are coming...    First, install this cloud connector https://github.com/mulesoft/google-connectors-suite/tree/master/gmail-connector    1) First of all, all the List attributes get the same lab"
1,Multiple Runtimes: Unknown node definition when using EE components on a project created with a CE Runtime,Precondition: you should have a Mule Studio workspace where you have installed a CE Mule Server.  Steps to reproduce:  # Create a project using the CE server.  # Switch the project runtime to a EE server.  # Try to use any EE-only component (Business Even
2,"Whenever the project has a change, Connections Explorer should warn the user to save the project changes before executing test connection","Whenever the project has a change, Connections Explorer should warn the user to save the project changes before executing test connection.    "
2,DataMapper: Exception generated when using an invalid JSON file,Steps to reproduce:   1.- Create a JSON to XML mapping   2.- Use a base JSON file with a bad structure   3.- Generate defaults for the XML     Issue: this exception is thrown in the error log     {code}  java.lang.RuntimeException: java.lang.RuntimeExcept
2,Add Processor Chain to the palette ,"If when using a 'choice' you use a filter inside a 'when' condition, if the filter is not inside a 'processor chain' them the ESB will fail when deploying the app.   The processor chain is already supported from the XML we only need to add it to the palet"
2,Reference Exception strategy should be able to be dropped inside a choice exception strategy ,I should be able to drop a 'Reference Exception Strategy' inside a 'Choice Exception Strategy'  
2,"When using connectivity test feature, libraries should be automatically loaded to the project","When using connectivity test feature, needed connectors libraries should be automatically added to the project path instead of showing an error. Same for metadata.  "
2,Transactional: is not being displayed when using the CE runtime ,"The transactional component has 3 options.   - Simple Transaction   - XA Transaction   - Multi Transaction     When the runtime used is CE, only the Simple transaction option should be displayed and the icon should be the common green.     When the runtim"
2,Transactional endpoints are missing the NOT_SUPPORTED action,"As part of the implementation of the new transactional element we need to add an action to the transactional endpoints.     When configuring a transaction in the followed endpoints: JMS, JDBC and VM. An action called ""Not Supported"" should be displayed in"
2,Documentation generation doesn't work when Flow name contains strange characters,"For example if the flow name is: ""Flow That Does This (and also this)"" the generated doc links are not working. Even if there was a component in that flow that has documentation, it is not displayed anywhere.  "
4,No universal way to make comments across GUI and XML,"This jira is a bit unusual..    The problem I find is that because I am limited on the comments I can make on the studio canvas on message processors (name:doc) I end up also writing comments in the xml, this spreading out of comments to describe what the"
1,Export to DOCs brings an NPE if you clic when no project is opened,Steps to reproduce:     1.- Open Studio in a new workspace   2.- Close the welcome screen and then clic in the export to DOC button     issue: the followed NPE appears in the error log:     {code}  java.lang.NullPointerException    org.mule.tooling.studoc
2,Studio deployer needs to support classloader override,"We're trying to use Studio for a project that uses a cloud connector with a dependency to jettison that requires classloading override as described in this page: http://www.mulesoft.org/documentation/display/MULE3USER/Classloader+Control+in+Mule    So, I "
2,Lossing enpoint reference to a global endpoint across different flow files,How to re-crecreate:   (1) Create global endpoints (i.e. file:endpoint)in a dedicated flow file to store all global components.   (2) Then reference the global endpoints across from separate flow files.  (3) Complete the flow and test it to make sure it i
2,Resize DM new input argument dialog so the expression field is visible,<ditto>
2,Validation error when refering to a global EJB,"When defining a global EJB like this:  {code:xml}   <spring:beans>   <jee:remote-slsb id=""testServiceBean"" jndi-name=""ejb:/ejbToCall-0.0.1-SNAPSHOT//TestService!com.acxiom.commonsoap.ejbtocall.TestServiceRemote""   			business-interface=""com.acxiom.commons"
2,Studio 3.4 refers to Mule 3.2 schemas in the XML catalog,See the attached screen shot to grok the issue.
4,Automatically add schemas to the XML catalog for referenced libraries,"One can add Mule modules to the Referenced Libraries either manually or with Maven. Not all these modules are DevKit built.    It would be great if Studio could scan the JARs, recognize the Mule modules and add entries to the XML catalog (for both version"
2,Contribution sources points to non existent jar,"Here's a sample plugin.xml    <?xml version=""1.0"" encoding=""UTF-8"" standalone=""no""?><plugin><extension point=""org.mule.tooling.core.contribution""><externalContribution contributionJar=""mule-module-servicesource-1.0-SNAPSHOT.jar"" contributionJavaDocs=""mule"
2,Create error when XML is invalid,"When saving an invalid configuration XML, an error message pops up that explains what the error is and at what line number it is located.    This error isn't reported in the Eclipse Problems view nor it is marked by red marker in the XML editor. It would "
2,Consider enabling search for task tags by default,"By default, task tags is not enabled in General>Editors>Structured Test Editors>Task Tags.    Activating it by default would provide task tags support in XML configuration files."
2,XML matching tag highlighting does not work,"Even though ""Matching Tag"" is enabled in General>Editor>Text Editors>Annotation, the matching tag (for ex. </flow> when positioned on <flow>) doesn't get highlighted."
2,ALL mflows are deleted when modifying the buildpath,"Take any project, go to the build path options and make whatever modification, such as adding items to the classpath.    After you click ok, the .classpath file is rewriten and all mflows are deleted from the filesystem. You can actually see the delete op"
2,<set-variable> and <flow-ref> should have their doc:name attributes default to more relevant values,"Right now by default when you add tags such as <set-variable> or <flow-ref> their doc:name attributes default to things like Variable or Flow Reference.    Unless the user provides something specific, they should default to something more representative o"
2,Error database connector name needs to be unique,"Studio complaining with both database connectors and database source that the name needs to be unique when there is only one connector, so it is unique.    This may be happening with other endpoints but I have only seen it with Database elements."
3,Classes from included java build path projects not available at runtime,Step to reproduce:    * Download the attached projects and import them into studio  * Edit the build path of the mule project and add the test-dependency project as a required project  * Run the flow    This will trigger the exception: Caused by: java.lan
2,Datamapper dependencies are not added to the studio generated pom,When trying to run tests with maven using the studio generated pom file I run into the following issues:    Invalid content was found starting with element 'data-mapper:config'    Then I add this:    <dependency>        <groupId>com.mulesoft.muleesb.modul
3,Object builder should work with static meta-data,#NAME?
2,Mule Debugger and Java Debugger collide,"When debugging a mule flow ctrl+shift+i opens up a mule evaluation window that allows you to test mule expression. This is all fine.    However, when debugging a java transformer, the same shortcut should open the java evaluation window as in regular ecli"
2,flow ref editor should be alpha sorted and allow filtering,"When editing a flow ref, the select box that list the available flows is not alpha sorted.     A filter textbox above it would also be extremely helpful"
3,Support for referencing external resources,"I've imported a project build with Maven into Studio.  The project includes (in the project pom, as one of it's dependencies) a module with some particular flows and other resources such as spring beans or connectors.    In the project's pom:          <de"
1,"When publishing to application repository, application name accepts characters which are not allowed by MMC and action fails",How to reproduce:    *) Build an application which includes a flow that contains a space in its name (eg. Spell Checker from http://www.mulesoft.org/documentation/display/MULE3START/Basic+Studio+Tutorial)    *) Publish to Application Repository from Studi
