3,Support for request/reply,request/reply  http://www.mulesoft.org/documentation/display/current/Routing+Message+Processors#RoutingMessageProcessors-RequestReply  Mockups here: http://corp.wiki.mulesource.com/display/WP/Request-Reply#Request-Reply-Mockups 
2,Cloud Connectors are missing from plugin,These cloud connectors are missing from the plugin:     twitter  twilio  sfdc  mongo  magento  cmis    The result is I get an exception along the lines of:    org.xml.sax.SAXParseException: schema_reference.4: Failed to read schema document 'http://www.mu
2,Setting the serviceClass attribute in a SOAP message processor (JAX-WS Service) produces garbage text,"Setting the SOAP service class attribute through the Mule Studio interface produces garbage data:    <cxf:jaxws-service serviceClass=""interface HelloInterface [in [Working copy] HelloInterface.java [in mulestudio.test [in src/main/java [in soap-interface-"
2,Endpoint exchange-pattern is automatically set to one-way after explicity stating it should be request-response,"Endpoint exchange patterns are set to ""one-way"" when adding a new endpoint to an existing flow or changing the properties of other scopes, endpoints or message processors.    To reproduce:    1) Create a new flow  2) Add any endpoint which defaults to one"
2,"In New Project wizard, New Mule Flow dialog doesn't replace whitespaces in the project name with underscores for the flow filename","Steps to reproduce:    1. Goto File -> New -> Other  2. Select Mule Project and click on ""Next >""  3. Type in the name field ""Ajax Spell Checker"" and click on ""Next >""    The New Mule Flow dialog has the File name field set to the project name but it does"
2,Cannot use transaction ee:xa-transactional or ee:multi-transactional from a test case,"Getting the following error in the console when trying to run a test case that uses ee:xa-transactional or ee:multi-transactional:    ERROR 2013-02-13 13:24:53,863 [Thread-1] com.mulesource.licm.impl.TrueLicenseHelper: Couldn't validate license key!"
2,ALL processor ignores news processors in certain situations,Steps to reproduce:    1. Drag the ALL processor to a flow in the drawing area  2. Add a processor to the ALL  3. Add a processor to the ALL in a seperate path  4. Goto the Configuration XML tab  5. Goto the Message Flow tab  6. Add another processor to t
2,Export can't handle jar files when not in workspace,"I have a project that has a jar file in a lib directory (more precisely, the mysql driver).    The project is located in /Users/marianogonzalez/Documents/source/myproject.     If I try to export the project to mule or upload it to cloudhub, I get an error"
2,Run history ,When in your workspace you have more that one project you use to run several of them.  As a result you start getting a history in the run/debug button of the IDE with the last app run.    In eclipse when you close a project the apps related to that projec
1,Should not display confirmation dialogue upon successful retrieval of meta-data. ,"Once meta-data is successfully retrieved, we should not display a success dialogue. Dialogue should only be shown on failure."
3,ObjectBuilder usability improvements,- Values left as empty in the object builder should not show-up in the XML. - Object builder reference column usability. - We can't get rid of the reference column all-together.  - Object builder structure should look like DM (and reuse DM UI if possible)
2,"DataMapper should not show meta-data objects as KV pairs, but as an Object ","When a data structure contains XMLGregorianCalendar, its type representation should not require the explicit definition of a factory in Studio (this should happen automatically).  Furthermore, XMLGregorianCalendar should be automatically mappable to Date "
3,XMLGregorianCalendar should be automatically mappable and Date->XMLGregorialCalendar mappings should be possible with simple mapping. ,"When a data structure contains XMLGregorianCalendar, its type representation should not require the explicit definition of a factory in Studio (this should happen automatically).  Furthermore, XMLGregorianCalendar should be automatically mappable to Date "
1,Remove archived examples from Studio,* Packaged examples should be modified as per the following plan: https://docs.google.com/a/mulesoft.com/spreadsheet/ccc?key=0ArwrJmCfHowWdDNCdnJYeldHcDI5M0dYaTRsWUwxd2c#gid=2    * This requires the following additional work:      - Creation of the two ne
1,Remove examples marked as Archive from Studio,* Packaged examples should be modified as per the following plan: https://docs.google.com/a/mulesoft.com/spreadsheet/ccc?key=0ArwrJmCfHowWdDNCdnJYeldHcDI5M0dYaTRsWUwxd2c#gid=2  * This requires the following additional work:     - Creation of the two new i
2,Place all examples in GIT,* Packaged examples should be modified as per the following plan: https://docs.google.com/a/mulesoft.com/spreadsheet/ccc?key=0ArwrJmCfHowWdDNCdnJYeldHcDI5M0dYaTRsWUwxd2c#gid=2    * This requires the following additional work:      - Creation of the two ne
2,Updating the set of connectors available in the connections explorer,"The list of connectors shown in the Connections Explorer view is incomplete. The following is a list of connectors which cannot be chosen by the user when they try to add a new connector by clicking the ""plus"" sign in the Connections Explorer.          - "
2,Dragging and dropping a Rollback Exception Strategy into a flow messes up the Message Flow canvas,Dragging and dropping a rollback exception strategy moves the text but not the whole widget.    Steps to reproduce:    1) Create a flow scope  2) Create a global rollback exception strategy  3) Click on the text inside the exception strategy and drag it i
3,Studio Phase I support for APIkit,REST module spec is: http://corp.wiki.mulesource.com/display/WP/Simplified+REST+Service+Creation    Studio L&F should be as per the attached mockups. 
2,A Rollback Exception Strategy on a flow prevents the generation of documentation for that flow,A Rollback Exception Strategy on a flow prevents the generation of documentation for that flow
2,Global endpoint and connector descriptions of certain transports are identical.,"The descriptions of a global endpoint and a connector found in the properties page of certain transports are the same.     As an example, the description of a POP3 connector is as follows:    ""The POP3 Endpoint allows Mule applications to retrieve email f"
2,Excel To JSON template looks for the wrong type of excel spreadsheet,"In the excel-to-json template, the File inbound-endpoint is looking for a file with the extension "".xlsx"". However, the file in ""src/test/resources"" has the extension "".xls"". The result is that the file is not consumed."
2,New JDBC endpoint turns all previous JDBC endpoints to one-way in visual editor,Steps to reproduce:  -------------------    1) Import the attached project  2) Drag and drop an HTTP endpoint from the palette to create e new flow  3) Switch to XML editor and copy the last JDBC endpoint to the clipboard  4) Paste the clipboard contents 
2,Select the sort direction connector queries,"As a Studio developer, I want to select a sort field and sort direction for my query (if the connector supports it) so that I can find data in my application that I'm looking for.    Acceptance criteria:  * I can sort by CreatedDate ascending or descendin"
2,Display and customize generated connector queries,"As a Studio developer, I want to see the generated query for my connector and customize it so that I can understand what is going on and can do advanced queries, such as joins.    Acceptance Criteria:  * Salesforce SOQL expressions are displayed  * I can "
2,Mule 3.4 Pairing with Registry,"As a Mule user, I would like to configure my Mule instance to be paired with my Registry account through my registry key so that I may be able to manage my ESB instance's endpoints with the registry.     User should be configure the registry key for their"
2,Testing - Mule 3.4 Pairing with GA Registry,"As a Mule user, I would like to configure my Mule instance to be paired with my Registry account through my registry key so that I may be able to manage my ESB instance's endpoints with the registry.   User should be configure the registry key for their r"
2,Mule 3.4 Dynamic Lookup with Registry,"As a Studio user, I would like to use the dynamic lookup component within my flows.  Detailed specs defined here:   http://corp.wiki.mulesource.com/display/WP/Dynamic+Router+%28supports+Registry+Dynamic+Endpoint+Resolution%29"
2,Public docs on enabling/creating a connector with meta-data support,... 
2,Studio Welcome Page Update,Updated Studio welcome page.     At a minimum the front page should contain a description of the included runtime and the fact that other runtimes can be obtained. 
2,Cloud Connectors that do Not have Meta-data Should Work with new meta-data enabled version of Studio without issues,"Connectors which were built with the new DevKit, and which do not have any meta-data annotations, should work as they were working before, without the introduction of meta-data. "
2,Maven - POM.XML dependencies update when other components than CCs are used,"As the present POM.XML is only automatically updated when CCs are used. However, all changes within the Studio canvas should lead to the automatic update of POM.XML. "
2,Maven - Import existing Maven project into Studio,"As a Maven developer, I would like to import an existing (non-Studio) maven Mule project into Studio and start using Studio to develop. "
2,Retrieved metadata from operations must be available through different Studio session.,As a user I want to have the operation metadata I retrieve available in different Studio sessions.  (Operations Metadata must be cached on disk)
2,Getting exception when attempting to add a SalesForce Cloud Connector,"An exception is thrown when attempting to add a salesforce cloud connector to a flow file. The following error message is returned: ""Cannot get Mule ESB - Studio Artifacts!""    Steps to reproduce:  1) Create a new mule project and select the option to cre"
2,DataMapper fields not alphabetized for Maps/POJOs,"When creating a mapping from a Salesforce object to a CSV, my Salesforce fields were not alphabetically, making it very hard to navigate.  As such, when the input/output of a DataMapper is a Map, then the fields of the structure should be sorted alphabeti"
2,Incorrect XML is generated when changing the transaction demarcation of nested transactions,"XML is incorrectly generated when a flow contains nested transactions    Say you have two transaction scopes, the second being inside the first. The XML would look as follows:    {code:xml}  <transactional ... >      <transactional ... >           ...    "
2,Data sources can be viewed from Connection Explorer,"Data sources can be viewed from Connection Explorer. According to docs, only cloud connectors and connectors should be viewed"
2,Problem saving after project move,"Steps to reproduce:     1.- Install eGit plugin   2.- Create a project  3.- Right clic on it, Team > Share Project   4.- Create a git repository and share the project   5.- Make a modification in the project and then Save     Issue: the followed NPE is ra"
3,Support for Multiple Versions of Cloud Connectors within Studio,"As a Studio user, I would like to be able to open multiple projects in Studio which each use different versions of Cloud Connectors. The Cloud Connector's version could go back to a version as old as 2 years prior to the time at which the version of Studi"
2,Select metadata object in data mapper type configuration,"As a developer, I want to be able to tell data mapper to use the structure from any object my connector is aware of for the mapping.     For example, let's say I want to query Salesforce and that query returns a List of Account objects. Because Studio is "
2,Meta-data terminology and DataSense Branding,"Throughout Studio's customer visible elements, the term meta-data should be replaced with DataSense - the official name for this product feature. Specifically:  - In the connector pane, 'Use Metadata' should be replaced with ""Enable DataSense"". - In the c"
2,Dragging elements inside the ALL processor generates incorrect XML,Steps to reproduce:    1) Drag an ALL processor to the Message Flow canvas  2) Place a widget and a logger on one path  3) Place another widget and logger on another path  4) Drag one of the loggers onto the other path  5) Go to the XML view.    You shoul
2,Arrows are rendered incorrectly when a composite source contains an endpoint whose exchange-pattern is request-response,"When a composite source contains one or more inbound-endpoints with an exchange pattern of ""request-response"" and is followed by a message processor, the arrows are rendered incorrectly.    Steps to reproduce:    1) Create a composite source and place an "
2,NullPointerException when adding a query in a JDBC endpoint or connector,Steps to reproduce:    1) Create a JDBC inbound endpoint  2) Open its properties page by double clicking on it  3) Go to the Queries tab  4) Input a query key and press tab while the textbox is still in focus  
2,Update Mule-common library to include enhanced error management and new maps features,Update Mule-common library to version 0.9.0 to include enhanced error management and new maps features
2,Generate default option should be disabled when there are no fields to generate from,"When creating a Data Mapping flow, there is an option which generates default input/output fields based on output/input fields respectively.    This option should be disabled when there are no fields to generate from. When there are no input fields, the """
2,Selecting the text() attribute of XML elements in data mapping files causes a NullPointerException,"Steps to reproduce:    1) Create a new Data Mapping flow file. Make sure that at least the input or output is XML.  2) Add a new field to the XML input (or output) and set its type to ""Element"".  3) Double click on the ""text()"" attribute which is created "
2,Nested attributes are created when adding an XML element with a name identical to an existing attribute,"Steps to reproduce:    1) Create a new Data Mapping flow file. Make sure that at least the input or output is XML and contains an attribute (let's call it ""name"").  2) Add a new field with the same name and set its type to ""Element"".    You should get an "
2,Cannot open non-Studio Mule projects in Eclipse when Studio plugins installed," I have updated my Eclipse distribution with the Studio plugins  [2/28/13 5:05:07 PM] Reza Shafii: things worked great, until I tried to open a non-studio project's Mule flow config, that's when I got this exception:  [2/28/13 5:05:08 PM] Reza Shafii: ava"
2,Integrate Custom Compiled Cloud Connectors into Studio,"We will have to integrate custom cloud connectors into Studio... again. This will take time since it implies changing how Cloud Connectors are fetched, using local items (kinda ""hard coded"")."
2,Maven: NPE when pom is not parseable,"Whenever the pom is malformed, therefore causing it not to be parseable, it will raise an NPE when saved."
3,NPE when creating the first CE project on a new workspace,"When downloading the CE runtime, creating a new workspace and creating a new CE project, if the user drops a database component and switches to EE the user is not warned that the namespace will change and if he drops a new database component and tries to "
2,Editing configuration deletes all processor configured fields,When you edit the configuration of a global element opening the screen from the Pattern Properties screen after saving you lose all fields configuration made to the flow.    Steps to reproduce:    1) Create a flow and set some of the fields required for t
2,Ability to handle errors with individual records in data mapper,"As a developer, I want to be able to handle individual records that have errors in my data mapping. Currently I can only stop processing everything, or I can silently ignore the errors.  If this option is enabled, the exception strategy would be invoked f"
2,DataSense should use the proper type field depending on the connector. ,"DataSense asumes that the type field with the sOBject type for example is always called type. This is not the case, as many connectors use a different field to this end.    DataSense should use the correct one, not asume it is called 'type'"
1,Avoid trying to get metadata when the connector reference is not configured,"When the config reference is null, Studio must not try to get metadata. This generates null values in the cache, that must be avoided."
2,When modifying the pom.xml the .mflow file somehow gets updated and you need to save it again before running the project,"Steps to reproduce:   1.- Create a project with a pom file  2.- Check that the mflow file is saved.   3.- Open the pom file, add a modification and save     Issue: the mflow file is updated and you didn't perform any modification to it "
2,Maven: add an option to manually refresh the projects dependencies,This is for the cases when the pom is handled when studio is closed and the user wants to update the classpath.
1,Connectivity Testing/Get Metadata Types is not using the values in the configuration dialog for Global Connectors,Connectivity Testing/Get Metadata Types is not using the values in the configuration dialog for Global Connectors. It should use the newly entered values.
2,Metadata Cache Consistency,"Ensure consistency of the metadata cache.     When a project is deleted, the elements from that project should be removed, for example. The same happens when elements are removed from any flow, etc."
3,Add support for POJOs in the Object builder and persist them in the XML,Add support for displaying and editing POJOs in the object builder. The changes made to a POJO in the object builder should be reflected in the XML.
2,Maven: should detect if Maven is installed and prevent the user from enabling maven support/fail at doing maven things,"Actually if the user does not have Maven installed, or has the path to his maven installation configured incorrectly, things explode in an uncontrolled way. We need to work on this so as to prevent the user from using Maven features if he does not have Ma"
2,Maven: subsequent addition of new components may block because of pom being updated,"If the user drops, for example, an Ajax endpoint, a scripting component and an SMTP outbound endpoint, he will be blocked in the third step because Studio is still running the first studio:studio.  Studio should detect that there is already a Job updating"
2,Set up the continuous automated testing,We need to get the Jubula tests running by bamboo at nights.
2,Integrate the cloud connectors snapshot repository into the build,We need to integrate the new repository and set up things so that we can alter between the snapshots and the releases repository.
3,Maven: studio:studio duplicated referenced libraries with the ones in the Runtime (when they are transitive dependencies),"Direct dependencies that are included in the runtime are not duplicated, but this filter/rule is not applied to transitive dependencies (if a dependency has a mule transport as transitive dependency, it will be duplicated in the classpath)"
2,Remove Clover ETL  import functionality ,The Clover ETL options shouldn't be displayed in the Import  / Export dialog 
2,Scrip Component is not displaying the script text,Steps to reproduce:   1.- Create the travel agent template project.   2.- Open the groovy script configuration window     Issue: the script is not displayed in the UI 
2,Renaming  a file by using refactor option deletes all the scripts in the file,Steps to reproduce:   1.- Create the Travel Agent project  2.- Check the xml file and the scripts in it.   3.- Right clic on the Travel Agent.mflow and clic on refactor > rename  4.- Rename the file to Travel Agent2.mflow   5.- Go to the XML view     Issu
3,Combining all transformers into a single component.,"Currently all transformer components are listed separately, however, combining them into a single component after which the particular type of transformation can be selected will greatly simplify usability."
3,Combining Filters into a single Component,Combination of all filter components into a single one. User would then pick the type of filter after dropping the filter element into the canvas.   
3,Combining language components and transformers into as single one,"Combination of all language transformers and components into a single building block. User would then be able to pick a single component (say: Custom Logic) and then decide whether it is a component or transformer, then pick the language to use. "
1,Metadata doesn't propagate past an enricher,"Since an enricher does not change the payload - it normally just puts stuff in a flowVar, we should be able to propagate metadata past it.  "
1,POM-added JAR dependencies are not added to exported archive,"Steps to reproduce  1. created a project in Studio  2. added a dependency to the pom.xml*  3. The dependency is added to the project and I can find the packages and classes when writing Java (good)  4. However,when I export (File-> Export->Mule package) t"
2,"For composite filters, Studio's UI doesn't allow names, validations require it and throw error","When adding composite filters (Or, And, Not) and adding a component sub-filter , the UI for the sub-filter does not have a field for the Name of this sub-filter.  However, the validation on the generated XML complains about this sub-element not having a n"
1,Change export documentation icon,Change the icon of the export documentation feature in the toolbar.
2,Include new examples in Studio,We need to include the following three new examples (developed by SE team) within the set of examples that are distributed with Studio:    - New Hello World Example  - APIs R Us Example  - SaaS Integration Example
2,Connectivity fails when using placeholders,"If placeholders are used to provided credentials to the connector and the connection is tested, error is returned.    *Steps to reproduce*    1. Place the following lines on the mule-app.properties  twitter.accessKey=729170916-itUkhAOVAmKEUHYy0tMHPat1xPKF"
1,DataMapper example is not working fine,Steps to reproduce:   1.= Create the excel to JSON template project  2.- Run the project  3.- Feed the flow with the provided xls file     Issue: the followed exception is raised in the console     {code}   ************************************************
1,DataSense: NPE when clicking OK in the object builder without configuring the object ,"Steps to reproduce:   1.- Create a SFC connection   2.- Configure a CC in the canvas, and set the operation to Create   3.- Select any sObject Type   4.- Clic the radio button to create the object manually, and clic in the object button   5.- Clic OK with"
2,Generate Documentation is not working with Order Processing template project,"Steps to reproduce:  1.- Create the Order Processing template project  2.- Export the project to documentation   Issue: the process is cancelled automatically and the documentation is not generated, the followed NPE is raised:   {code}  org.eclipse.swt.SW"
2,Rollback Exception Strategy is not well drawn in the canvas,"When the expression is to long the drawing of the box is not correct, check the attached screenshot.     "
3,Get Studio interop use cases tested and to a green satus,Priority 1 use cases listed within the Studio table here:    http://corp.wiki.mulesource.com/display/interop/Interoperability+Home+Page
2,Metadata does not get the appropiate metadata for arguments different than the one marked as default payload,"Metadata does not get the appropiate metadata for arguments different than the one marked as default payload.    This is problematic for elements that have many lists, for example, in the editor.    Metadata should bring the specific metadata for each arg"
2,APIkit - Interface/Service File Support,"As an APIkit developer, I should be able to create a Mule project in Studio, add XML files to my flow folder and add APIkit interfaces. Studio should not display errors when I do this and my project should build and run with the APIkit interfaces availabl"
1,Object Builder: I shouldn't be able to set the string attribute name ,"Steps to reproduce:   1.- Create a SFCD connection, add an endpoint and configure a get Updated Object operation.   2.- Configure the sObject type to Account   3.- Open the object builder and configure some strings      Issue: you are able to set names in"
1,Replace new Studio Help Files,Update the Studio help files with the ones in the attached file.
2,Dynamic Endpoint Naming and Shape,The dynamic endpoint component in Studio should be modified as follows:    - Name should be changed from 'Dynamic Router' to 'Anypoint Service Registry'.  - Color should be changed from yellow to blue.  - Component should be moved from flow-control to end
2,Improving the way lists are managed and displayed in the Object builder.,Improving the way lists are managed and displayed in the Object builder. Some big refactorings will be required.
1,Maven: when no maven installation is found the error message shows a null location,Check screenshot
2,Maven: deleting maven from /usr/share while studio is opened is letting users to create mvn projects.,When deleting maven from /usr/share while having studio opened is not being validated letting the users to create incomplete maven projects.
2,Export to deployable archive should include transitive project dependencies,"When exporting to a deployable archive, classes and jars from referenced projects should be included in the resulting zip file."
